            PART A

//INSERT VALUES IN PERSON TABLE


mysql> INSERT INTO PERSON VALUES(1,"ANUGRAH","KOZHIKODE",2003,254562365472);
mysql> INSERT INTO PERSON VALUES(2,"AKASH","KOYILANDY",2002,124536987596);
mysql> INSERT INTO PERSON VALUES(3,"ABHINAND","PATTAMBI",1999,456325632541);
mysql> INSERT INTO PERSON VALUES(4,"SINAN","MALAPPURAM",2001,654125639658);
mysql> INSERT INTO PERSON VALUES(5,"YADU","KOZHIKODE",2001,758486954251);


mysql> SELECT * FROM PERSON;
+------+----------+------------+------+--------------+
| SSN  | NAME     | CITY       | DOB  | ADHAR_NO     |
+------+----------+------------+------+--------------+
|    1 | ANUGRAH  | KOZHIKODE  | 2003 | 254562365472 |
|    2 | AKASH    | KOYILANDY  | 2002 | 124536987596 |
|    3 | ABHINAND | PATTAMBI   | 1999 | 456325632541 |
|    4 | SINAN    | MALAPPURAM | 2001 | 654125639658 |
|    5 | YADU     | KOZHIKODE  | 2001 | 758486954251 |
+------+----------+------------+------+--------------+
5 rows in set (0.00 sec)


//INSERT VALUES IN STUDENT TABLE

mysql> INSERT INTO STUDENT VALUES(1,"NUSHRI",22,"VAYANAD","FEMALE");
mysql> INSERT INTO STUDENT VALUES(2,"BANU",22,"VAYANAD","FEMALE");
mysql> INSERT INTO STUDENT VALUES(3,"LUMNA",22,"MALAPPURAM","FEMALE");
mysql> INSERT INTO STUDENT VALUES(4,"HADIYA",22,"MALAPPURAM","FEMALE");
mysql> INSERT INTO STUDENT VALUES(5,"AMALA",22,"KOZHIKODE","FEMALE");


mysql> SELECT * FROM STUDENT;
+---------+--------+------+------------+--------+
| ROLL_NO | NAME   | AGE  | ADDRESS    | GENDER |
+---------+--------+------+------------+--------+
|       1 | NUSHRI |   22 | VAYANAD    | FEMALE |
|       2 | BANU   |   22 | VAYANAD    | FEMALE |
|       3 | LUMNA  |   22 | MALAPPURAM | FEMALE |
|       4 | HADIYA |   22 | MALAPPURAM | FEMALE |
|       5 | AMALA  |   22 | KOZHIKODE  | FEMALE |
+---------+--------+------+------------+--------+
5 rows in set (0.00 sec)


// INSERT VALUES IN INVOICE DATABASE

mysql> USE INVOICE;
Reading table information for completion of table and column names
You can turn off this feature to get a quicker startup with -A

Database changed

1.INSERT INTO CUSTOMER

mysql> INSERT INTO CUSTOMER(ID,NAME,ADDRESS,CITY) VALUES(10001,"ANUGRAH","ULLIYERI","CALICUT");
Query OK, 1 row affected (0.00 sec)
mysql> INSERT INTO CUSTOMER VALUES(10002,"ABHINAND","PATTAMBI","PALAKKAD",1234567895);
mysql> INSERT INTO CUSTOMER VALUES(10003,"AKASH","PAYYOLI","KOYILANDY",3654987125);
mysql> INSERT INTO CUSTOMER VALUES(10004,"SINAN","KALLAYI","MALAPPURAM",4561235876);
mysql> INSERT INTO CUSTOMER VALUES(10005,"YADU","THAMARASSERY","CALICUT",1524367895);

mysql> SELECT * FROM CUSTOMER;
+-------+----------+--------------+------------+------------+
| ID    | NAME     | ADDRESS      | CITY       | PH_NO      |
+-------+----------+--------------+------------+------------+
| 10001 | ANUGRAH  | ULLIYERI     | CALICUT    |       NULL |
| 10002 | ABHINAND | PATTAMBI     | PALAKKAD   | 1234567895 |
| 10003 | AKASH    | PAYYOLI      | KOYILANDY  | 3654987125 |
| 10004 | SINAN    | KALLAYI      | MALAPPURAM | 4561235876 |
| 10005 | YADU     | THAMARASSERY | CALICUT    | 1524367895 |
+-------+----------+--------------+------------+------------+
5 rows in set (0.00 sec)



2. INSERT INTO PRODUCT VALUES

mysql> INSERT INTO PRODUCT VALUES(1,"PEN",50);
Query OK, 1 row affected (0.00 sec)
mysql> INSERT INTO PRODUCT VALUES(2,"PENCIL",60);
mysql> INSERT INTO PRODUCT VALUES(3,"SOAP",100);
mysql> INSERT INTO PRODUCT VALUES(4,"SPOON",111);
mysql> INSERT INTO PRODUCT VALUES(5,"TORCH",150);

mysql> SELECT * FROM PRODUCT;
+-----+--------+-------+
| PID | PNAME  | PRICE |
+-----+--------+-------+
|   1 | PEN    |    50 |
|   2 | PENCIL |    60 |
|   3 | SOAP   |   100 |
|   4 | SPOON  |   111 |
|   5 | TORCH  |   150 |
+-----+--------+-------+
5 rows in set (0.00 sec)


3.INSERT INTO INVOICE_MASTER

mysql> INSERT INTO INVOICE_MASTER VALUES(101,10001,'2000-01-01');
Query OK, 1 row affected (0.00 sec)
mysql> INSERT INTO INVOICE_MASTER VALUES(102,10002,'2002-02-02');
mysql> INSERT INTO INVOICE_MASTER VALUES(103,10003,'2003-03-03');
mysql> INSERT INTO INVOICE_MASTER VALUES(104,10004,'2004-04-04');
mysql> INSERT INTO INVOICE_MASTER VALUES(105,10005,'2005-05-05');


mysql> SELECT * FROM INVOICE_MASTER;
+--------+---------+------------+
| INV_ID | CUST_ID | INV_DATE   |
+--------+---------+------------+
|    101 |   10001 | 2000-01-01 |
|    102 |   10002 | 2002-02-02 |
|    103 |   10003 | 2003-03-03 |
|    104 |   10004 | 2004-04-04 |
|    105 |   10005 | 2005-05-05 |
+--------+---------+------------+
5 rows in set (0.00 sec)

4.INSERT INTO INVOICE_ITEM

mysql> INSERT INTO INVOICE_ITEM VALUES(101,1,1);
mysql> INSERT INTO INVOICE_ITEM VALUES(101,2,3);
mysql> INSERT INTO INVOICE_ITEM VALUES(101,3,2);
mysql> INSERT INTO INVOICE_ITEM VALUES(102,5,1);
mysql> INSERT INTO INVOICE_ITEM VALUES(103,4,3);
mysql> INSERT INTO INVOICE_ITEM VALUES(104,2,3);
mysql> INSERT INTO INVOICE_ITEM VALUES(105,1,4);


mysql> SELECT * FROM INVOICE_ITEM;
+--------+------+----------+
| INV_ID | PID  | QUANTITY |
+--------+------+----------+
|    101 |    1 |        1 |
|    101 |    2 |        3 |
|    101 |    3 |        2 |
|    102 |    5 |        1 |
|    103 |    4 |        3 |
|    104 |    2 |        3 |
|    105 |    1 |        4 |
+--------+------+----------+
7 rows in set (0.00 sec)




          PART-B  DML UPDATE
          
          
        
        
1.UPDATE THE PRICE OF A PARTICULAR PRODUCT


mysql> SELECT * FROM PRODUCT;
+-----+--------+-------+
| PID | PNAME  | PRICE |
+-----+--------+-------+
|   1 | PEN    |    50 |
|   2 | PENCIL |    60 |
|   3 | SOAP   |   100 |
|   4 | SPOON  |   111 |
|   5 | TORCH  |   150 |
+-----+--------+-------+
5 rows in set (0.00 sec)


mysql> UPDATE PRODUCT SET PRICE=80 WHERE PNAME="SOAP";
  

mysql> SELECT * FROM PRODUCT;
+-----+--------+-------+
| PID | PNAME  | PRICE |
+-----+--------+-------+
|   1 | PEN    |    50 |
|   2 | PENCIL |    60 |
|   3 | SOAP   |    80 |
|   4 | SPOON  |   111 |
|   5 | TORCH  |   150 |
+-----+--------+-------+
5 rows in set (0.00 sec)


2.CHANGE CITY CALICUT TO KOZHIKODE

mysql> UPDATE CUSTOMER SET CITY="KOZHIKODE" WHERE CITY="CALICUT";
Query OK, 2 rows affected (0.00 sec)
Rows matched: 2  Changed: 2  Warnings: 0

mysql> SELECT * FROM CUSTOMER;
+-------+----------+--------------+------------+------------+
| ID    | NAME     | ADDRESS      | CITY       | PH_NO      |
+-------+----------+--------------+------------+------------+
| 10001 | ANUGRAH  | ULLIYERI     | KOZHIKODE  |       NULL |
| 10002 | ABHINAND | PATTAMBI     | PALAKKAD   | 1234567895 |
| 10003 | AKASH    | PAYYOLI      | KOYILANDY  | 3654987125 |
| 10004 | SINAN    | KALLAYI      | MALAPPURAM | 4561235876 |
| 10005 | YADU     | THAMARASSERY | KOZHIKODE  | 1524367895 |
+-------+----------+--------------+------------+------------+
5 rows in set (0.00 sec)


3.UPDATE PRICES WITH 2% OF ITS ORIGINAL PRICE

mysql> SELECT * FROM PRODUCT;
+-----+--------+-------+
| PID | PNAME  | PRICE |
+-----+--------+-------+
|   1 | PEN    |    50 |
|   2 | PENCIL |    60 |
|   3 | SOAP   |    80 |
|   4 | SPOON  |   111 |
|   5 | TORCH  |   150 |
+-----+--------+-------+
5 rows in set (0.00 sec)


mysql> UPDATE PRODUCT SET PRICE=PRICE+(PRICE*2/100);
Query OK, 5 rows affected (0.00 sec)
Rows matched: 5  Changed: 5  Warnings: 0


mysql> SELECT * FROM PRODUCT;
+-----+--------+-------+
| PID | PNAME  | PRICE |
+-----+--------+-------+
|   1 | PEN    |    51 |
|   2 | PENCIL |    61 |
|   3 | SOAP   |    82 |
|   4 | SPOON  |   113 |
|   5 | TORCH  |   153 |
+-----+--------+-------+
5 rows in set (0.00 sec)


4.CHANGE ADDRESS,CITY,PHONE NUMBER OF A PARTICULAR CUSTOMER


mysql> SELECT * FROM CUSTOMER;
+-------+----------+--------------+------------+------------+
| ID    | NAME     | ADDRESS      | CITY       | PH_NO      |
+-------+----------+--------------+------------+------------+
| 10001 | ANUGRAH  | ULLIYERI     | KOZHIKODE  |       NULL |
| 10002 | ABHINAND | PATTAMBI     | PALAKKAD   | 1234567895 |
| 10003 | AKASH    | PAYYOLI      | KOYILANDY  | 3654987125 |
| 10004 | SINAN    | KALLAYI      | MALAPPURAM | 4561235876 |
| 10005 | YADU     | THAMARASSERY | KOZHIKODE  | 1524367895 |
+-------+----------+--------------+------------+------------+
5 rows in set (0.00 sec)


mysql> UPDATE CUSTOMER SET ADDRESS="WAYANAD",CITY="THRISSUR",PH_NO=7584869512 WHERE ID=10001;
Query OK, 1 row affected (0.00 sec)
Rows matched: 1  Changed: 1  Warnings: 0



mysql> SELECT * FROM CUSTOMER;
+-------+----------+--------------+------------+------------+
| ID    | NAME     | ADDRESS      | CITY       | PH_NO      |
+-------+----------+--------------+------------+------------+
| 10001 | ANUGRAH  | WAYANAD      | THRISSUR   | 7584869512 |
| 10002 | ABHINAND | PATTAMBI     | PALAKKAD   | 1234567895 |
| 10003 | AKASH    | PAYYOLI      | KOYILANDY  | 3654987125 |
| 10004 | SINAN    | KALLAYI      | MALAPPURAM | 4561235876 |
| 10005 | YADU     | THAMARASSERY | KOZHIKODE  | 1524367895 |
+-------+----------+--------------+------------+------------+
5 rows in set (0.00 sec)


5.CHANGE THE QUANTITY OF A PRODUCT INV_ID 101


mysql> SELECT * FROM INVOICE_ITEM;
+--------+------+----------+
| INV_ID | PID  | QUANTITY |
+--------+------+----------+
|    101 |    1 |        1 |
|    101 |    2 |        3 |
|    101 |    3 |        2 |
|    102 |    5 |        1 |
|    103 |    4 |        3 |
|    104 |    2 |        3 |
|    105 |    1 |        4 |
+--------+------+----------+
7 rows in set (0.00 sec)


mysql> UPDATE INVOICE_ITEM SET QUANTITY=5 WHERE INV_ID=101;
Query OK, 3 rows affected (0.00 sec)
Rows matched: 3  Changed: 3  Warnings: 0


mysql> SELECT * FROM INVOICE_ITEM;
+--------+------+----------+
| INV_ID | PID  | QUANTITY |
+--------+------+----------+
|    101 |    1 |        5 |
|    101 |    2 |        5 |
|    101 |    3 |        5 |
|    102 |    5 |        1 |
|    103 |    4 |        3 |
|    104 |    2 |        3 |
|    105 |    1 |        4 |
+--------+------+----------+
7 rows in set (0.00 sec)






        PART-C   DML DELETE
        
        
        
        
1.DELETE THE RECORD OF CUSTOMER ID 10001


  //FIRST DELETE INVOICE_ITEM INV_ID=101 
 
 
mysql> SELECT * FROM INVOICE_ITEM;
+--------+------+----------+
| INV_ID | PID  | QUANTITY |
+--------+------+----------+
|    101 |    1 |        5 |
|    101 |    2 |        5 |
|    101 |    3 |        5 |
|    102 |    5 |        1 |
|    103 |    4 |        3 |
|    104 |    2 |        3 |
|    105 |    1 |        4 |
+--------+------+----------+
7 rows in set (0.00 sec)


mysql> DELETE FROM INVOICE_ITEM WHERE INV_ID=101;
Query OK, 3 rows affected (0.00 sec)

mysql> SELECT * FROM INVOICE_ITEM;
+--------+------+----------+
| INV_ID | PID  | QUANTITY |
+--------+------+----------+
|    102 |    5 |        1 |
|    103 |    4 |        3 |
|    104 |    2 |        3 |
|    105 |    1 |        4 |
+--------+------+----------+
4 rows in set (0.00 sec)


  //SECOND DELETE INVOICE_MASTER INV_ID=101
  

mysql> SELECT * FROM INVOICE_MASTER;
+--------+---------+------------+
| INV_ID | CUST_ID | INV_DATE   |
+--------+---------+------------+
|    101 |   10001 | 2000-01-01 |
|    102 |   10002 | 2002-02-02 |
|    103 |   10003 | 2003-03-03 |
|    104 |   10004 | 2004-04-04 |
|    105 |   10005 | 2005-05-05 |
+--------+---------+------------+
5 rows in set (0.00 sec)


mysql> DELETE FROM INVOICE_MASTER WHERE INV_ID=101;
Query OK, 1 row affected (0.00 sec)

mysql> SELECT * FROM INVOICE_MASTER;
+--------+---------+------------+
| INV_ID | CUST_ID | INV_DATE   |
+--------+---------+------------+
|    102 |   10002 | 2002-02-02 |
|    103 |   10003 | 2003-03-03 |
|    104 |   10004 | 2004-04-04 |
|    105 |   10005 | 2005-05-05 |
+--------+---------+------------+
4 rows in set (0.00 sec)

  
   //THIRD DELETE CUSTOMER ID=10001
   
   
mysql> SELECT * FROM CUSTOMER;
+-------+----------+--------------+------------+------------+
| ID    | NAME     | ADDRESS      | CITY       | PH_NO      |
+-------+----------+--------------+------------+------------+
| 10001 | ANUGRAH  | WAYANAD      | THRISSUR   | 7584869512 |
| 10002 | ABHINAND | PATTAMBI     | PALAKKAD   | 1234567895 |
| 10003 | AKASH    | PAYYOLI      | KOYILANDY  | 3654987125 |
| 10004 | SINAN    | KALLAYI      | MALAPPURAM | 4561235876 |
| 10005 | YADU     | THAMARASSERY | KOZHIKODE  | 1524367895 |
+-------+----------+--------------+------------+------------+
5 rows in set (0.00 sec)


mysql> DELETE FROM CUSTOMER WHERE ID=10001;
Query OK, 1 row affected (0.00 sec)


mysql> SELECT * FROM CUSTOMER;
+-------+----------+--------------+------------+------------+
| ID    | NAME     | ADDRESS      | CITY       | PH_NO      |
+-------+----------+--------------+------------+------------+
| 10002 | ABHINAND | PATTAMBI     | PALAKKAD   | 1234567895 |
| 10003 | AKASH    | PAYYOLI      | KOYILANDY  | 3654987125 |
| 10004 | SINAN    | KALLAYI      | MALAPPURAM | 4561235876 |
| 10005 | YADU     | THAMARASSERY | KOZHIKODE  | 1524367895 |
+-------+----------+--------------+------------+------------+
4 rows in set (0.00 sec)


2.DELETE ALL PURCHASE DETAILS OF ITEMS ITS QUANTITY LESS THAN 2

mysql> SELECT * FROM INVOICE_ITEM;
+--------+------+----------+
| INV_ID | PID  | QUANTITY |
+--------+------+----------+
|    102 |    5 |        1 |
|    103 |    4 |        3 |
|    104 |    2 |        3 |
|    105 |    1 |        4 |
+--------+------+----------+
4 rows in set (0.00 sec)


mysql> DELETE FROM INVOICE_ITEM WHERE QUANTITY<2;
Query OK, 1 row affected (0.00 sec)

mysql> SELECT * FROM INVOICE_ITEM;
+--------+------+----------+
| INV_ID | PID  | QUANTITY |
+--------+------+----------+
|    103 |    4 |        3 |
|    104 |    2 |        3 |
|    105 |    1 |        4 |
+--------+------+----------+
3 rows in set (0.00 sec)


3.DELETE THE PURCHASE DETAILS OF PRODUCT 'PEN' IN THE INV_ID '105'

mysql> SELECT * FROM INVOICE_ITEM;
+--------+------+----------+
| INV_ID | PID  | QUANTITY |
+--------+------+----------+
|    103 |    4 |        3 |
|    104 |    2 |        3 |
|    105 |    1 |        4 |
+--------+------+----------+
3 rows in set (0.00 sec)

mysql> SELECT * FROM PRODUCT;
+-----+--------+-------+
| PID | PNAME  | PRICE |
+-----+--------+-------+
|   1 | PEN    |    51 |
|   2 | PENCIL |    61 |
|   3 | SOAP   |    82 |
|   4 | SPOON  |   113 |
|   5 | TORCH  |   153 |
+-----+--------+-------+
5 rows in set (0.00 sec)

mysql> DELETE FROM INVOICE_ITEM WHERE INV_ID=105 AND PID=1;
Query OK, 1 row affected (0.00 sec)

mysql> SELECT * FROM INVOICE_ITEM;
+--------+------+----------+
| INV_ID | PID  | QUANTITY |
+--------+------+----------+
|    103 |    4 |        3 |
|    104 |    2 |        3 |
+--------+------+----------+
2 rows in set (0.00 sec)


4.DELETE DETAILS OF EMPLOYEES WHO DOES NOT HAVE PHONE NUMBER


mysql> SELECT * FROM CUSTOMER;
+-------+----------+--------------+------------+------------+
| ID    | NAME     | ADDRESS      | CITY       | PH_NO      |
+-------+----------+--------------+------------+------------+
| 10002 | ABHINAND | PATTAMBI     | PALAKKAD   | 1234567895 |
| 10003 | AKASH    | PAYYOLI      | KOYILANDY  | 3654987125 |
| 10004 | SINAN    | KALLAYI      | MALAPPURAM | 4561235876 |
| 10005 | YADU     | THAMARASSERY | KOZHIKODE  |       NULL |
+-------+----------+--------------+------------+------------+
4 rows in set (0.00 sec)

//FIRST DELETE INVOICE_MASTER CUST_ID=10005

mysql> SELECT * FROM INVOICE_MASTER;
+--------+---------+------------+
| INV_ID | CUST_ID | INV_DATE   |
+--------+---------+------------+
|    102 |   10002 | 2002-02-02 |
|    103 |   10003 | 2003-03-03 |
|    104 |   10004 | 2004-04-04 |
|    105 |   10005 | 2005-05-05 |
+--------+---------+------------+
4 rows in set (0.00 sec)

mysql> DELETE FROM INVOICE_MASTER WHERE CUST_ID=10005;
Query OK, 1 row affected (0.00 sec)

mysql> SELECT * FROM INVOICE_MASTER;
+--------+---------+------------+
| INV_ID | CUST_ID | INV_DATE   |
+--------+---------+------------+
|    102 |   10002 | 2002-02-02 |
|    103 |   10003 | 2003-03-03 |
|    104 |   10004 | 2004-04-04 |
+--------+---------+------------+
3 rows in set (0.00 sec)


// THEN DELETE THE CUSTOMER TABLE ID=10005

mysql> DELETE FROM CUSTOMER WHERE PH_NO IS NULL;
Query OK, 1 row affected (0.00 sec)

mysql> SELECT * FROM CUSTOMER;
+-------+----------+----------+------------+------------+
| ID    | NAME     | ADDRESS  | CITY       | PH_NO      |
+-------+----------+----------+------------+------------+
| 10002 | ABHINAND | PATTAMBI | PALAKKAD   | 1234567895 |
| 10003 | AKASH    | PAYYOLI  | KOYILANDY  | 3654987125 |
| 10004 | SINAN    | KALLAYI  | MALAPPURAM | 4561235876 |
+-------+----------+----------+------------+------------+
3 rows in set (0.00 sec)



5.DELETE ALL RECORDS FROM STUDENT TABLE

Database changed
mysql> USE ANUGRAH;
Database changed
mysql> SELECT * FROM STUDENT;
+---------+--------+------+------------+--------+
| ROLL_NO | NAME   | AGE  | ADDRESS    | GENDER |
+---------+--------+------+------------+--------+
|       1 | NUSHRI |   22 | VAYANAD    | FEMALE |
|       2 | BANU   |   22 | VAYANAD    | FEMALE |
|       3 | LUMNA  |   22 | MALAPPURAM | FEMALE |
|       4 | HADIYA |   22 | MALAPPURAM | FEMALE |
|       5 | AMALA  |   22 | KOZHIKODE  | FEMALE |
+---------+--------+------+------------+--------+
5 rows in set (0.00 sec)

mysql> DELETE FROM STUDENT;
Query OK, 5 rows affected (0.01 sec)

mysql> SELECT * FROM STUDENT;
Empty set (0.00 sec)
//VERIFIED
